173	https://job-boards.greenhouse.io/twilio/jobs/7819432	Twilio	Director, GTM Business Architecture
174	https://job-boards.greenhouse.io/twilio/jobs/7705877	Twilio	Director of North America, Pre-Sales Platform Specialists
175	https://job-boards.greenhouse.io/twilio/jobs/7565884	Twilio	Director, Product Management
176	https://job-boards.greenhouse.io/twilio/jobs/7435334	Twilio	HRBP Director, Product Management
177	https://job-boards.greenhouse.io/twilio/jobs/7641333	Twilio	New Business Account Executive - Public Sector
178	https://job-boards.greenhouse.io/gleanwork/jobs/4685575005	Glean	Enterprise Regional Director, Southeast
179	https://job-boards.greenhouse.io/gleanwork/jobs/4663045005	Glean	Partner Solutions Architect
180	https://job-boards.greenhouse.io/gleanwork/jobs/4482380005	Glean	Product Manager, Connectors
181	https://job-boards.greenhouse.io/gleanwork/jobs/4591195005	Glean	Public Sector Solutions Engineer, SLED
182	https://job-boards.greenhouse.io/gleanwork/jobs/4685389005	Glean	Public Sector Solutions Engineer, SLED
183	https://job-boards.greenhouse.io/gleanwork/jobs/4657199005	Glean	Senior Technical Program Manager, Connectors
184	https://job-boards.greenhouse.io/gleanwork/jobs/4508312005	Glean	Solutions Architect
185	https://job-boards.greenhouse.io/gleanwork/jobs/4664302005	Glean	Strategic Federal Account Executive, Public Sector (DIB)
186	https://job-boards.greenhouse.io/celonis/jobs/7493399003?gh_jid=7493399003	Celonis	Account Executive - Public Sector
